Age Group,Nutritional Needs,Sample Diet Plan,Common Nutrition Issues,Responses
0-6 months,"Breast milk or formula, Vitamin D supplement",Breastfeeding or iron-fortified formula,Insufficient milk production,"Breast milk is the primary source of nutrition. If breastfeeding is not possible, use an iron-fortified formula."
6-12 months,"Iron-rich foods, soft solids, Vitamin C","Mashed vegetables, fruit, soft meats","Food allergies, constipation",Introduce iron-rich foods like pureed meats and legumes along with soft fruits and vegetables.
1-3 years,"Balanced diet, 3 meals + 2 snacks",Small portions of family meals,"Picky eating, choking hazards","Offer small, balanced portions of family meals and encourage self-feeding."
3-5 years,"Variety of foods, high fiber, protein","Whole grains, vegetables, fruits, lean meats","Obesity risk, lack of vegetables",Ensure variety in meals and include more vegetables and fruits. Limit sugary snacks.
5-10 years,"Increased calcium, iron, and fiber","Dairy, fortified cereals, vegetables","Skipping meals, food aversions",Encourage a balanced diet with dairy and iron-rich foods to support growing bones and muscles.
10-12 years,"Healthy fats, protein, balanced diet","Whole grains, lean meats, fruits, vegetables","Peer pressure, poor meal habits",Help them understand the importance of healthy eating habits and avoid processed foods.
